Book Id,Title,Author,Author l-f,Additional Authors,ISBN,ISBN13,My Rating,Average Rating,Publisher,Binding,Number of Pages,Year Published,Original Publication Year,Date Read,Date Added,Bookshelves,Bookshelves with positions,Exclusive Shelf,My Review,Spoiler,Private Notes,Read Count,Recommended For,Recommended By,Owned Copies,Original Purchase Date,Original Purchase Location,Condition,Condition Description,BCID
12784437,Asia's Unknown Uprisings Volume 1: South Korean Social Movements in the 20th Century,George Katsiaficas,"Katsiaficas, George",,"=""1604864575""","=""9781604864571""",0,4.32,PM Press,Paperback,480,2012,2012,,2017/07/17,to-read,to-read (#74),to-read,,,,0,,,0,,,,,
23301545,The Sleeper and the Spindle,Neil Gaiman,"Gaiman, Neil",Chris Riddell,"=""1408859645""","=""9781408859643""",5,3.90,Bloomsbury Publishing Plc,Hardcover,72,2014,2014,2017/05/17,2017/07/17,,,read,"Great short story to add to your shelves, especially if you are light on stories that center bad ass female warriors. You could call it a children's book, but I think it's good reading for adults too.",,,1,,,0,,,,,
1442300,As the World Burns: 50 Simple Things You Can Do to Stay in Denial,Derrick Jensen,"Jensen, Derrick",Stephanie McMillan,"=""1583227776""","=""9781583227770""",4,3.77,Seven Stories Press,Paperback,224,2007,2007,2017/06/25,2017/07/17,,,read,"Yessss. Buy this for all your friends who tend toward sadness when things are going well for them, sadness because they know that things aren't going well for most of the world, most especially the environment, and they feel guilty they aren't doing more to help. Guilty, and angry, and pissed off, and maybe a little mad. This book won't make them feel better, but for a short time they will laugh and fell understood by at least one other person.<br/><br/><blockquote><br/>Why do you hate violence that frees the victims of greater violence, even more than the original violence?<br/></blockquote>",,,1,,,0,,,,,
12906062,Latino USA: A Cartoon History,Ilan Stavans,"Stavans, Ilan",Lalo Alcaraz,"=""0465082505""","=""9780465082506""",3,3.84,Basic Books,Paperback,224,2012,2000,2017/06/15,2017/07/17,,,read,"I'm such a sucker for historical graphic novels, so was very predisposed toward liking this. And I did like it, but I also am very much a novice of Latin American culture so can't attest to the accuracy here. I appreciated that the author used the cast of characters to present opposing viewpoints and seemed to be making a genuine effort at being un-biased. Or rather, at admitting that everyone is biased, and then presenting many of the biases in the various speakers.<br/><br/>My primary nit was the tendency toward presenting history as a string of battles and Great Men (something the author himself made fun of). I would have liked to see more women mentioned. In the older history when sexism prevented women almost entirely from having a public voice I can make allowances, but in the parts of the book which focused on more recent history it seemed strange not to see more women. ",,,1,,,0,,,,,
7808792,Dreamland: The Way Out of Juarez,Charles Bowden,"Bowden, Charles",Alice Leora Briggs,"=""0292722079""","=""9780292722071""",5,3.95,University of Texas Press,Paperback,165,2010,2010,2017/06/04,2017/07/17,,,read,"As I read the book I was taking pictures of favorite quotes and saving them in my notes, but soon I had to stop because it was every damn page. I love how the author and the artist threaded together multiple story lines, differentiating the plots by the fonts, art, and even rhythm of the words.<br/><br/>This was an inspiring example of how to bite into a hugely complex system and resist the urge to offer part-solutions. And in fact to show the futility of trying to take and treat any one chunk outside of the context of the whole.<br/><br/><blockquote><br/>“Small improvements could be made in this system. Decent wages paid by American companies in Juarez would lessen the violence and slow or end illegal immigration in that area, but this is impossible because the companies must compete with business in Asia. Legalizing drugs would destroy the cartel and end the cash flow into their hands of tens of billions of dollars a year, but this is impossible because American citizens would consume drugs without guilt. Opening government files would prevent future cooperation with killers, but this is impossible because of the need for national security.<br/><br/>And giving security documents to me is well nigh impossible, because this would jeopardize careers and pensions and family dreams.<br/><br/>Everything is impossible except the status quo.”<br/></blockquote><br/><br/><blockquote><br/>“Here is how it works: first some incident, say twelve men buried carefully in the backyard of a condo in a decent neighborhood, catches one’s attention. Then one investigates and sees the incident as part of a larger problem. Then one sees the problem as really an issue. Then one sees the issue as really a question that demands a new policy. Then, one feels comfort. Problem/issue/policy/defined and question answered. This is the death of the mind that slaughters the intellect of the educated on the line. Sometimes this death comes before anything but little fragments have been examined and the mind dies wrapped around the notion of, say, the drug war. Or of illegal immigration. Or of trade as embodied in the North American Free Trade Agreement (NAFTA). Cures are suggested: just say no, hire more narcs, an open border, guest worker permits, vigils against violence, poetry readings, plays, magazine stories such as I have written, heralding new horrors to savor.<br/><br/>I’ve moved into some place beyond that. I am here to announce the obvious, the war. It rages all along the line, it kills thousands, it slaughters beneath notice and it will spill gore on my ground when my bones rest in the brown earth I love. Thirty or forty years from now, the American adventures into the bowels of the Middle East will be forgotten details of bumbling imperialism. But what took place in this patio, what is taking place all along the line will profoundly alter the future of the United States. The future is here, even though I can’t even catch a trace of the rotting bodies with their gaping, toothy mouths.” <br/></blockquote>",,,1,,,0,,,,,
22114037,Fantomas Versus the Multinational Vampires: An Attainable Utopia,Julio Cortázar,"Cortázar, Julio",David Kurnick,"=""1584351349""","=""9781584351344""",3,3.63,Semiotext(e),Paperback,87,2014,1975,2017/07/14,2017/07/17,,,read,"An enjoyable experiment in layout and content, though honestly I found it confusing to follow most of the time. I think I need to read more Cortazar and come back to this, or more Latin American authors in general, I've only barely scratched the surface.",,,1,,,0,,,,,
638794,Sula,Toni Morrison,"Morrison, Toni",,"=""0375415351""","=""9780375415357""",5,3.86,Knopf,Hardcover,192,2002,1973,2017/07/02,2017/07/17,,,read,"The slow work of moving to a less discriminatory world gets me down sometimes, and then I feel bad about feeling down because I know I have no reason to feel *really bad* since my life is objectively great. There is this odd guilt loop that can infect perfectly healthy people and make them ineffectual, and I've felt it trying to get a grip on me.<br/><br/>So it was in this mood that I read Sula, and received from the story a treasure trove of insight into how to remain calm in the face of all the bullshit (something women of color have become very good at). This book really spoke to me, about the shape and fragility of friendships, and about the importance of keeping all evils in perspective. <br/><br/><blockquote><br/>""Because each had discovered years before that they were neither white nor male, and that all freedom and Triumph was forbidden to them, they had set about creating something else to be.""<br/></blockquote><br/><br/><blockquote><br/>""What was taken by outsiders to be slackness, slovenliness or generosity was in fact a full recognition of the legitmacy of forces other than good ones. They did not believe doctors could heal -- for them, none had ever done so. They did not believe death was accidental -- life might be, but death was deliberate . . . . The purpose of evil was to survive it and they determined (without ever knowing they had made up their minds to do it) to survive floods, white people, tuberculosis, famine and ignorance. They knew anger well but not despair, and they didn't stone sinners for the same reason they didn't commit suicide -- it was beneath them.""<br/></blockquote><br/>",,,1,,,0,,,,,
15811545,A Tale for the Time Being,Ruth Ozeki,"Ozeki, Ruth",,"=""0670026638""","=""9780670026630""",4,3.98,Viking,Hardcover,422,2013,2013,2017/07/09,2017/07/17,,,read,"This book was a *trip*. I felt like I was in Electricity Town and BC and the monastery, but beyond physical travel I felt like Ozeki was giving me a tour in how to be a storyteller. Doing more with perspective in a single story than I have ever experienced before. <br/><br/>If any of my friends read this I would _love_ to talk to you about it. Even if you don't like it, if you read any of it, I'll even listen to your rants, it's just the kind of book that begs for people to compare notes and impressions.",,,1,,,0,,,,,
6976853,The Art of Asking Your Boss for a Raise,Georges Perec,"Perec, Georges",,"=""1844674193""","=""9781844674190""",4,3.89,Verso,Hardcover,96,2011,1968,2017/07/16,2017/07/17,,,read,"This story follows the paths of a decision tree; uninterrupted by either capitalization or punctuation to simulate the ""thoughts"" of a computational program. This probably sounds maddening, but it wasn't, it was weird and immersive and I totally loved it.<br/><br/>Check out the introduction: https://books.google.com/books?id=CPVRCwAAQBAJ&printsec=frontcover#v=onepage&q&f=false<br/><br/>And more book details: https://www.versobooks.com/books/2296-the-art-of-asking-your-boss-for-a-raise",,,1,,,0,,,,,
28749,The Brief and Frightening Reign of Phil,George Saunders,"Saunders, George",,"=""1594481520""","=""9781594481529""",4,3.67,Riverhead Books,Paperback,130,2005,2005,2017/07/17,2017/07/17,,,read,"This was great! It is a short story, so very worth the read. Especially if you enjoy satire. I would say more, but it is so brief that anything else will be spoilers. Just start reading: http://www.reignofphil.com/excerpt.html",,,1,,,0,,,,,
32191680,No Apparent Distress: A Doctor's Coming-of-Age on the Front Lines of American Medicine,Rachel Pearson,"Pearson, Rachel",,"=""0393249247""","=""9780393249248""",5,4.16,W. W. Norton  Company,Hardcover,272,2017,2017,2017/08/21,2017/06/26,,,read,"Phenomenal. Very well written and entirely relatable for anybody who has ever needed medical care.<br/><br/><blockquote><br/>If you are a patient at a private clinic then you can be pretty sure that most of your doctor's mistakes have already been made, they were made on the bodies of the poor.<br/></blockquote>",,,1,,,0,,,,,
32564955,Letter to a Young Farmer: How to Live Richly Without Wealth on the New Garden Farm,Gene Logsdon,"Logsdon, Gene",Wendell Berry,"=""160358725X""","=""9781603587259""",4,4.54,Chelsea Green Publishing Company,Hardcover,,2017,,2017/03/12,2017/06/12,,,read,A collection of short essays that speak to a style of living and engaging with the earth that is slowly going out of style. I really enjoyed getting to spend a few hours celebrating the country intellectual.,,,1,,,0,,,,,
8549879,Holy Shit: Managing Manure to Save Mankind,Gene Logsdon,"Logsdon, Gene",,"=""1603582517""","=""9781603582513""",5,4.26,Chelsea Green Publishing Company,Paperback,204,2010,2010,2017/04/23,2017/06/11,,,read,"Gene Logsdon is the long lost uncle I never had, I feel like we would have been friends given the change. His writing is clear and funny and extremely accessible. I grew up on a farm, so I may be biased, but I think that the books he writes could be read by anybody.<br/><br/>Even if you never intend to have animals and figure out how to optimize your property for nutrient retention, knowing that this is how farmers really think about the world is valuable. There are a lot of people who don't personally know a farmer anymore and I think that distance can become dangerous, when we don't have a personal connection to a way of life it can start to seem alien and weird. The farmers are our friends, most of them are incredibly smart, and incredibly dedicated to preserving biodiversity and a healthy environment. I think that people like Gene really helped bridge the gap between rural and urban.<br/><br/>One favorite quote from the book in talking about limits to growth:<br/>P. 146 Invariably, at the root of every collapse was an agricultural mistake. Or perhaps more accurately, at the root of every decline was an agricultural advancement that did not admit to the laws of natural limitation, and so became an agricultural mistake.",,,1,,,0,,,,,
53413,Hopscotch,Julio Cortázar,"Cortázar, Julio",Gregory Rabassa,"=""0394752848""","=""9780394752846""",0,4.25,Pantheon,Paperback,564,1987,1963,,2017/06/11,to-read,to-read (#73),to-read,,,,0,,,0,,,,,
8464781,Island Beneath The Sea,Isabel Allende,"Allende, Isabel",,"=""0007348649""","=""9780007348640""",5,4.01,HarperCollins,Hardcover,457,2010,2009,2017/05/03,2017/06/11,,,read,"This novel put me in mind of Half of a Yellow Sun (one of my favorites). The two books share an incredible level of story crafting that weaves real and imagined characters together, giving the simultaneous experience of a personal story and an accurate history of an area or era.<br/><br/>I didn't know very much about Haiti and what I got from the story was often horrifying but also very inspiring. Ninety-nine point nine percent of the time I felt like I wasn't so much reading as falling into this story, the writing was that good. The odd off percentage were the moments where she used the word ""lugubrious"". I have never encountered that word so many times in one book, maybe it's just more common that I knew...",,,1,,,0,,,,,
6748,A Supposedly Fun Thing I'll Never Do Again:  Essays and Arguments,David Foster Wallace,"Wallace, David Foster",,"=""0316925284""","=""9780316925280""",5,4.28,Back Bay Books,Paperback,353,1998,1996,2017/05/28,2017/06/11,,,read,"Five stars for the title essay alone, it was hilarious and sad and true.<br/><br/>One very favorite quote from the title essay is prompted by a sponsored essay in the luxury cruise liner brochure. Wallace points out that:<br/>“An ad that pretends to be art is -- at absolute best -- like somebody who smiles warmly at you only because he wants something from you. This is dishonest, but what's sinister is the cumulative effect that such dishonesty has on us: since it offers a perfect facsimile or simulacrum of goodwill without goodwill's real spirit, it messes with our heads and eventually starts upping our defenses even in cases of genuine smiles and real art and true goodwill. It makes us feel confused and lonely and impotent and angry and scared. It causes despair.”<br/><br/>I've continued to think about that quote. The essay was written in ~1996, so it is at least 20 years old now, and when I think about 20 years ago I feel like the world had way *less* advertising than we have in our lives now. Especially advertising of the disingenuous, don't-look-too-close, hey I'm not an ad I'm a brand presence and this is art, kind of ad. ",,,1,,,0,,,,,
46756,"Oryx and Crake (MaddAddam, #1)",Margaret Atwood,"Atwood, Margaret",,"=""0385721676""","=""9780385721677""",0,4.00,Anchor,Paperback,400,2004,2003,2017/06/01,2017/06/11,,,read,"I'm still getting used to Margaret Atwood and have only read a few things by her. So far the most dissonant part of reading her works is the surprising amount of sexism or (what seems to me) to be excessively gender stereotyped characters. The lead female in this story for example had a pretty underwhelming character development and was mostly on screen as a sex object.<br/><br/>That said, it was an interesting story and I did read it through to the end, but I don't know if I'll continue the series.",,,1,,,0,,,,,
813033,The Atlas of Literature,Malcolm Bradbury,"Bradbury, Malcolm",,"=""1556708793""","=""9781556708794""",0,4.09,"Stewart, Tabori, & Chang",Hardcover,352,1996,1996,,2017/06/10,to-read,to-read (#72),to-read,,,,0,,,0,,,,,
25942967,Whipping Girl: A Transsexual Woman on Sexism and the Scapegoating of Femininity,Julia Serano,"Serano, Julia",,"=""1580056229""","=""9781580056229""",0,4.19,Seal Press,Paperback,424,2016,2007,,2017/06/03,currently-reading,currently-reading (#1),currently-reading,,,,1,,,0,,,,,
6617037,"Debt: The First 5,000 Years",David Graeber,"Graeber, David",,"=""1933633867""","=""9781933633862""",5,4.17,Melville House Publishing,Hardcover,534,2011,2011,2017/06/27,2017/06/03,,,read,,,,1,,,0,,,,,
9578127,"Beyond Inclusion, Beyond Empowerment: A Developmental Strategy To Liberate Everyone",Leticia Nieto,"Nieto, Leticia","Margot F. Boyer, Liz Goodwin, Garth R. Johnson, Laurel Collier Smith","=""0976611201""","=""9780976611202""",0,4.47,Cuetzpalin,Paperback,319,2010,2010,,2017/06/03,to-read,to-read (#71),to-read,,,,0,,,0,,,,,
25571952,Unstoppable: Harnessing Science to Change the World,Bill  Nye,"Nye, Bill",,"=""1250007143""","=""9781250007148""",5,4.20,St. Martin's Press,Hardcover,341,2015,2015,2017/04/14,2017/04/27,,,read,"Holy cow y'all, my childhood hero Bill Nye writes books for adults now! And he read the audiobook version himself and he sounds exactly the same, it was such a treat to listen to.<br/><br/>I highly recommend pairing this book with This Changes Everything by Naomi Klein, I read them back to back and the contrasts are valuable. Bill Nye is a tech geek and I could so relate to a lot of what he got excited about, but having just read Klein's book I found his absolute faith in technical solutions to be a tad overly optimistic and his never mentioning the racist roots of which areas get saddled with the most environmental degradation to be a big miss. Like many engineers he focuses entirely on the technical problem and ignores the equally interesting complex problem of the social forces that are shaping how we value things. Different books and different authors are going to have different specialities though, which is why I most recommend the two books together. I think that Klein was perhaps too dismissive of our technical solutions and too untrusting of the ability of engineers to empathize and build smart things that actually won't make the world a worse place.<br/><br/>I really enjoyed hearing Nye's perspectives on the many bad and a few good ideas about big technical possibilities for how to help our warming planet.",,,1,,,0,,,,,
21913812,This Changes Everything: Capitalism vs. The Climate,Naomi Klein,"Klein, Naomi",,"=""1451697384""","=""9781451697384""",5,4.17,Simon & Schuster,Hardcover,576,2014,2014,2017/04/12,2017/04/27,,,read,"I had been thinking about reading this book for months, the description sounded interesting and yet, the title was so.... braggy? Something about it was vaguely off putting, plus the book is huge, and I am often a flake when it comes to huge books. They remind me of assigned readings in school and I promised myself a few years ago that I didn't have to read things I thought I ""should"" read, I could go ahead and only read the things that I actually wanted to. So I had to check it out from the library twice before I actually started reading it, but THEN hot damn I couldn't put it down.<br/><br/>There is so much information packed in here, it's a bit of an acronym plunge at times, but so good. I confess that when the audiobook became available from the library I switched to listening while I worked in the garden and found the pairing of climate science research with pulling up hundreds of pounds of English Ivy to be most satisfactory.<br/><br/>Some take aways:<br/> * We can't consume our way to a more sustainable future, producing and buying too much disposable shit is what got us into our current problems. This can be summarized in a tweet: https://twitter.com/amy_vetter/status/845000165538889733<br/> * So many examples large and small of environmental destabilization that isn't getting the media attention it really probably should<br/> * Some people really hated on her analogy about the earth having a miscarriage (read the book, it makes sense in context), but I loved it.<br/> * Respect for indigenous people and supporting their rights to the land could be what saves the land for all of us",,,1,,,0,,,,,
29771103,"Biting the Hands that Feed Us: How Fewer, Smarter Laws Would Make Our Food System More Sustainable",Baylen J. Linnekin,"Linnekin, Baylen J.",,"=""1610916751""","=""9781610916752""",4,3.91,Island Press,Hardcover,280,2016,,2017/04/14,2017/04/27,,,read,"Well researched and easy to read. I didn't agree with all of the authors conclusions, but I appreciated the way that he presented them - as in ""here are some ideas and suggestions"", rather than ""here is the absolute solution and anything else is stupid"".<br/><br/>Highly recommend to people who are interested in knowing more about the food system and how we can go about getting fresh healthy food for all people in the country.",,,1,,,0,,,,,
29405093,The Girl with the Lower Back Tattoo,Amy Schumer,"Schumer, Amy",,"=""1501139886""","=""9781501139888""",4,3.76,Gallery Books,Hardcover,323,2016,2016,2017/04/29,2017/04/27,,,read,"I really enjoyed listing to Amy Schumer read the audiobook version of this, I think author read audiobooks are absolutely the way to go when comedians write about themselves. I knew from a little prior exposure that her brand of humor isn't my favorite but I was curious about the person behind the never ending vagina jokes and she doesn't disappoint.<br/><br/>The world is extremely harsh toward women, especially women who are trying to make something of themselves in a male dominated field, especially especially when said women give zero fucks about what everybody else thinks of them and they aren't endlessly kind and pretty. When she talked about the pressure of having to ""speak for all women"" with every little thing she did I could relate. That pressure is real and it sucks. I'm glad that she is out there being herself and I hope that more of the world will warm up to the idea that women can come is just as many diverse packages as men, and that a woman doing her thing is not trying to redefine what women are, she is just trying to be herself.<br/>",,,1,,,0,,,,,
14761587,How Should a Person Be? A Novel From Life,Sheila Heti,"Heti, Sheila",,"=""1770892486""","=""9781770892484""",2,3.19,House of Anansi,Paperback,306,2012,2010,2017/04/25,2017/04/27,,,read,,,,1,,,0,,,,,
26067678,The Queue,Basma Abdel Aziz,"Aziz, Basma Abdel",Elisabeth Jaquette,"=""1612195164""","=""9781612195162""",5,3.56,Melville House,Paperback,224,2016,2012,2017/04/24,2017/04/27,,,read,"I haven't read a book this fast since the last Harry Potter came out, I really couldn't put it down, even though I thought I probably should just to give myself time to absorb it properly. It's a look into a surreal (but all too familiar and real feeling) dystopian future inspired by the authors experience of growing up in Egypt.<br/><br/>If you do read the book there is a lovely interview with the woman who translated it to English that is a must read (but only after reading the book - it has tons of spoilers). It was fascinating to hear about the challenges she faced in translating specific Arabic phrases into something that would carry the same meaning in English. https://thenewinquiry.com/let-loose-your-tongue/",,,1,,,0,,,,,
25734304,Throwing Rocks at the Google Bus: How Growth Became the Enemy of Prosperity,Douglas Rushkoff,"Rushkoff, Douglas",,"=""1617230170""","=""9781617230172""",4,3.88,Portfolio,Hardcover,288,2016,2016,,2017/02/20,,,read,,,,1,,,0,,,,,
13059271,The Top Five Regrets of the Dying: A Life Transformed by the Dearly Departing,Bronnie Ware,"Ware, Bronnie",,"=""""","=""""",0,3.69,,Kindle Edition,247,,2011,2016/04/09,2017/02/07,,,read,"This book was uncomfortable to read, and I guess that's why I'm glad that I read it. Parts of it made Bronnie Ware sound like an extreme crazy hippie, but I also felt like everything she shared was true. It was sweet and felt like a real persons genuine attempt to share what they know, and definitely not like something that was heavily edited and packaged to be a big hit with the public.",,,1,,,0,,,,,
30988092,Norse Mythology,Neil Gaiman,"Gaiman, Neil",,"=""006266364X""","=""9780062663641""",3,4.11,HarperAudio,Audiobook,6,2017,2017,2017/06/16,2017/02/04,,,read,Really fun collection of short stories from a master story teller - highly recommend the audiobook! Gaiman reads it himself and I also think these kind of tales were always intended to be passed on verbally.,,,1,,,0,,,,,
27161156,Hillbilly Elegy: A Memoir of a Family and Culture in Crisis,J.D. Vance,"Vance, J.D.",,"=""0062300547""","=""9780062300546""",0,3.98,Harper,Hardcover,264,2016,2016,,2017/02/04,to-read,to-read (#70),to-read,,,,0,,,0,,,,,
