Book Id,Title,Author,Author l-f,Additional Authors,ISBN,ISBN13,My Rating,Average Rating,Publisher,Binding,Number of Pages,Year Published,Original Publication Year,Date Read,Date Added,Bookshelves,Bookshelves with positions,Exclusive Shelf,My Review,Spoiler,Private Notes,Read Count,Recommended For,Recommended By,Owned Copies,Original Purchase Date,Original Purchase Location,Condition,Condition Description,BCID
26514673,The Story of My Teeth,Valeria Luiselli,"Luiselli, Valeria","Christina MacSweeney, Armando Durán, Thom Rivera","=""""","=""9781504664523""",2,3.44,Blackstone Audio,Audiobook,4,2015,2013,2017/09/20,2017/09/23,,,read,"This was interesting, but ultimately just a bit too odd for me to say more than ""it was ok"". I definitely wouldn't read it again, I almost didn't even finish, and I can't think of anybody I'd recommend it to. And yet there were moments that were really nice and those kept me going, but there just weren't enough of them.<br/><br/>I'm sure that some people will like this book a lot, just wasn't for me. I do intend to look up other things by this author though.<br/><br/>Some quote that I particularly liked:<br/>* ""By means of my hyperbolics, I could restore an objects value through an elegant surpassing of the truth.""<br/>* ""crabs in the bucket"" (new saying, I'd never heard it before)<br/>",,,1,,,0,,,,,
299215,The Road to Serfdom,Friedrich A. Hayek,"Hayek, Friedrich A.",,"=""0226320618""","=""9780226320618""",0,4.18,University Of Chicago Press,Paperback,274,1994,1944,,2017/09/20,to-read,to-read (#87),to-read,,,,0,,,0,,,,,
530878,Mean Spirit,Linda Hogan,"Hogan, Linda",,"=""0804108633""","=""9780804108638""",0,3.94,Ivy Books,Paperback,384,1991,1990,,2017/09/20,to-read,to-read (#86),to-read,,,,0,,,0,,,,,
32445729,Play Like a Girl: How a Soccer School in Kenya's Slums Started a Revolution,Ellie Roscher,"Roscher, Ellie",,"=""1632280574""","=""9781632280572""",4,4.20,Viva Editions,Paperback,,2017,,2017/09/11,2017/09/20,,,read,"Such an incredible story! It was a real pleasure to read through this book and get the insider's look of what building change looks like. Too often stories of aid are written by outsiders and people receiving the help are not given the credit they deserve.<br/><br/>It was pretty heart breaking to hear about all of the organizations that tried to just airdrop help on them, or the crooked partners who took the money and ran. But most of the cast here are courageous and creative people who are learning to thrive in an unlikely place.",,,1,,,0,,,,,
2050213,The Appointment,Herta Müller,"Müller, Herta","Michael Hulse, Philip Boehm","=""080506012X""","=""9780805060126""",4,3.41,Metropolitan Books,Hardcover,208,2001,1997,2017/09/24,2017/09/20,,,read,"This was really good, by far one of the best books I've read in translation. The tone it creates is this surveillance state level of tense, violent, absurdity. Then she'll just be funny, like actually tell a joke, but the setting is so stark and terrible that I felt like I shouldn't laugh - and I think that is exactly what she was trying to capture. What it feels like when your whole life has been taken over by an angry centralized authority.<br/><br/>The writing is lyrical and gorgeous, the dialogue is so smooth. With translation this good it makes me really curious what the experience would of been to read in her native language. I'll definitely be looking into more things by this author and the translators.<br/><br/><blockquote><br/>Are you really all right.<br/>Yes, how about you.<br/>How about me, my nose is still in the center of my face isn't it.<br/></blockquote><br/>",,,1,,,0,,,,,
31189192,Null States,Malka Ann Older,"Older, Malka Ann",,"=""""","=""""",0,4.08,Tor.com,ebook,432,2017,2017,,2017/09/20,to-read,to-read (#85),to-read,,,,0,,,0,,,,,
33917107,On Tyranny: Twenty Lessons from the Twentieth Century,Timothy Snyder,"Snyder, Timothy",,"=""0804190119""","=""9780804190114""",0,4.32,Tim Duggan Books,Paperback,128,2017,2017,,2017/09/18,to-read,to-read (#84),to-read,,,,0,,,0,,,,,
20170404,Station Eleven,Emily St. John Mandel,"Mandel, Emily St. John",,"=""0385353308""","=""9780385353304""",0,4.02,Knopf,Hardcover,336,2014,2014,,2017/09/18,to-read,to-read (#83),to-read,,,,0,,,0,,,,,
29972029,"Bitch Planet, Vol. 2: President Bitch",Kelly Sue DeConnick,"DeConnick, Kelly Sue","Taki Soma, Valentine De Landro","=""1632157179""","=""9781632157171""",0,4.37,Image Comics,Paperback,144,2017,2017,,2017/09/18,to-read,to-read (#82),to-read,,,,0,,,0,,,,,
25739154,Five Dollars and a Pork Chop Sandwich: Vote Buying and the Corruption of Democracy,Mary Frances Berry,"Berry, Mary Frances",,"=""0807076406""","=""9780807076408""",0,3.74,Beacon Press,Hardcover,192,2016,2016,,2017/09/18,to-read,to-read (#81),to-read,,,,0,,,0,,,,,
17251093,The Casual Vacancy,J.K. Rowling,"Rowling, J.K.",,"=""0316228583""","=""9780316228589""",5,3.28,Back Bay Books,Paperback,503,2013,2012,2017/09/04,2017/09/18,,,read,"J.K. beast mode Rowling wrote a non-magical novel for adults! Well she wrote it back in 2012, I'm just late to the party &#x1f601;. It's a damn good engaging story, which is reason enough to read and enjoy it, but it's also a peek into small town life and large scale social injustice.",,,1,,,0,,,,,
23546843,"Ms. Marvel, Vol. 3: Crushed",G. Willow Wilson,"Wilson, G. Willow","Takeshi Miyazawa, Elmo Bondoc","=""0785192271""","=""9780785192275""",5,4.21,Marvel Comics,Paperback,112,2015,2015,2017/09/18,2017/09/18,,,read,,,,1,,,0,,,,,
23017947,"Ms. Marvel, Vol. 2: Generation Why",G. Willow Wilson,"Wilson, G. Willow","Adrian Alphona, Jacob Wyatt","=""0785190228""","=""9780785190226""",5,4.14,Marvel,Paperback,136,2015,2015,2017/09/17,2017/09/18,,,read,,,,1,,,0,,,,,
20898019,"Ms. Marvel, Vol. 1: No Normal",G. Willow Wilson,"Wilson, G. Willow",Adrian Alphona,"=""078519021X""","=""9780785190219""",5,4.13,Marvel,Paperback,120,2014,2014,2017/09/17,2017/09/18,,,read,,,,1,,,0,,,,,
9549746,A Visit from the Goon Squad,Jennifer Egan,"Egan, Jennifer",,"=""0307477479""","=""9780307477477""",4,3.64,Anchor Books,Paperback,341,2011,2010,2017/07/24,2017/09/18,,,read,"Sorry, my review is not at all helpful -> here <a href=""https://www.goodreads.com/review/show/95456142?book_show_action=true&from_review_page=1"">read this one instead</a>.<br/><br/>Not the kind of story I normally like, it's a pop culture shit show kind of. The story centers on the music industry, douchey guys taking advantage of obnoxious girls, drugs, more dicks, and eventually their friends, children, etc. And yet it was a page turner, and it was interesting, and there were snippets that I really enjoyed. <br/><br/>",,,1,,,0,,,,,
18635092,The Truth is a Cave in the Black Mountains,Neil Gaiman,"Gaiman, Neil",Eddie Campbell,"=""006228214X""","=""9780062282149""",3,3.96,William Morrow,Hardcover,74,2014,2010,2017/08/29,2017/09/18,,,read,"Highly recommend the audiobook version (which Gaiman read himself *and* it includes tension building awesome musical accompaniment). It is a pretty short story, spooky and fun, perfect for a road trip.",,,1,,,0,,,,,
30555488,The Underground Railroad,Colson Whitehead,"Whitehead, Colson",,"=""0385542364""","=""9780385542364""",0,4.04,Doubleday Books,Hardcover,306,2016,2016,,2017/09/18,abandoned,abandoned (#22),abandoned,,,,0,,,0,,,,,
6916961,Although of Course You End Up Becoming Yourself: A Road Trip with David Foster Wallace,David Lipsky,"Lipsky, David",,"=""030759243X""","=""9780307592439""",3,3.89,Broadway,Paperback,320,2010,2010,2017/09/08,2017/09/18,,,read,"I revisit ""This is Water"" often and love talking to other people who have read David Foster Wallace's cruise ship piece. I wasn't sure about a book <i>about</i> him though, that seemed like it might be weird, but I had many hours of flights ahead of me, so I was downloading every even slightly interesting looking audiobook from the library to prepare.<br/><br/>And this was really interesting, not the parts where they talked about movies and sports, but the parts where they talked about the future of literature, technology, and the human condition. I could hear a lot of the ideas that would eventually become ""This is Water"" in the initial forms here.<br/><br/>If you aren't already a fan of Wallace this would probably just be weird, if you are it delivers a lot of his wit and weirdness.<br/><br/><blockquote><br/>I think every generation finds new excuses for why people behave in basically ugly manner. The only constant is the bad behavior. And our excuse now is technology.<br/></blockquote>",,,1,,,0,,,,,
32075825,The Rise and Fall of D.O.D.O.,Neal Stephenson,"Stephenson, Neal",Nicole Galland,"=""0062409166""","=""9780062409164""",0,3.97,William Morrow & Company,Hardcover,752,2017,2017,,2017/09/18,abandoned,abandoned (#21),abandoned,,,,0,,,0,,,,,
23298123,The Face,Ruth Ozeki,"Ozeki, Ruth",,"=""""","=""9781632060150""",0,4.10,Restless Books,ebook,,2015,2015,,2017/09/18,to-read,to-read (#80),to-read,,,,0,,,0,,,,,
13330433,"The Democracy Project: A History, a Crisis, a Movement",David Graeber,"Graeber, David",,"=""081299356X""","=""9780812993561""",4,4.05,Spiegel & Grau,Hardcover,352,2013,2012,2017/08/10,2017/09/18,,,read,"If you're curious about Occupy Wall Street, what the heck those people hoped to accomplish, and where their ideas were coming from this is a great book to pick up. I found a lot of inspiration in the pages and (as is typical of David Graeber) several newly pointed out problems to avoid.<br/><br/>One of my favorite sections in the book closely resembles <a href=""http://www.aljazeera.com/indepth/opinion/2011/11/2011112872835904508.html"">this</a> piece if you want to get a taste.<br/><br/>On Marxism and other socialist reforms:<br/><blockquote><br/>Even back in the 19th century, anarchists argued that this was a pipe dream. One cannot, they argued, create peace by training for war, equality by creating top-down chains of command, or, for that matter, human happiness by becoming grim joyless revolutionaries who sacrifice all personal self-realisation or self-fulfillment to the cause.<br/><br/>It's not just that the ends do not justify the means (though they don't), you will never achieve the ends at all unless the means are themselves a model for the world you wish to create.<br/></blockquote><br/><br/>That rang very true to me, that the means themselves must be a model for the world we wish to create.",,,1,,,0,,,,,
31945158,Trinidad Noir: The Classics,Earl Lovelace,"Lovelace, Earl",Robert Antoni,"=""1617754358""","=""9781617754357""",0,4.00,Akashic Books,Paperback,256,2017,,,2017/09/18,abandoned,abandoned (#20),abandoned,,,,0,,,0,,,,,
28748,The Very Persistent Gappers of Frip,George Saunders,"Saunders, George",Lane Smith,"=""1932416374""","=""9781932416374""",5,4.10,McSweeney's,Hardcover,84,2006,2000,2017/07/25,2017/09/18,,,read,"A child friendly introduction to luck, privilege, and compassion. Good for adults too TBH. The book is beautifully done and the story is very warm and light hearted.",,,1,,,0,,,,,
32171778,Threads: From the Refugee Crisis,Kate   Evans,"Evans, Kate",,"=""1786631733""","=""9781786631732""",5,4.20,Verso,Hardcover,176,2017,,2017/07/22,2017/09/18,,,read,"Kate Evans is brilliant (I'm just going to keep saying this). I shared a few images from Threads on <a href=""https://twitter.com/lashleigh/status/893961252023742465"">twitter</a> previously.<br/><br/>The visual investigative journalist is a powerful thing, she isn't just reporting on abstract data, this is stories from her first hand experience trying to help refugees and it is really powerful.",,,1,,,0,,,,,
13641208,Tenth of December,George Saunders,"Saunders, George",,"=""0812993802""","=""9780812993806""",3,3.96,Random House,Hardcover,251,2013,2013,2017/07/31,2017/09/18,,,read,"I was ""meh"" toward several of the short stories herein, but it's worth getting just for The Semplica Girl Diaries.",,,1,,,0,,,,,
51695,Living My Life,Emma Goldman,"Goldman, Emma",سهیلا بسکی,"=""0142437859""","=""9780142437858""",0,4.29,Penguin Classics,Paperback,672,2006,1388,,2017/09/18,to-read,to-read (#79),to-read,,,,0,,,0,,,,,
29633660,Speak Gigantular,Irenosen Okojie,"Okojie, Irenosen",,"=""1909762296""","=""9781909762299""",0,3.70,Jacaranda,Paperback,206,2016,2016,,2017/09/18,abandoned,abandoned (#19),abandoned,"Unless you are really into spooky, horror stuff I don't recommend this. I only skimmed a couple stories and then abandoned ship, it is not my cup of tea.",,,0,,,0,,,,,
25387808,Red Rosa: A Graphic Biography of Rosa Luxemburg,Kate   Evans,"Evans, Kate",Paul M. Buhle,"=""1784780995""","=""9781784780999""",5,4.17,Verso,Paperback,224,2015,2015,2017/08/02,2017/09/18,,,read,"This is amazing!!! Kate Evans is wildly talented and you should buy all of her books (she was also nice to me on twitter once, but that isn't why I'm saying this).<br/><br/>The graphic biography format is just something that I like, I know that I like it, so I wasn't really surprised to like this one too, but I also think it is one of the best of that genre I've ever seen. So if you aren't sure if graphic biographies are something you'd be into this is a good one to try out.<br/><br/>I'm not saying I agree with all of Luxemburg's politics, but they were (still are) revolutionary, she had a vision and a way for organizing that is very inspiring and I'm looking forward to finding out more.",,,1,,,0,,,,,
857318,The Puttermesser Papers,Cynthia Ozick,"Ozick, Cynthia",,"=""0679777393""","=""9780679777397""",2,3.59,Vintage,Paperback,256,1998,1997,2017/08/07,2017/09/18,,,read,"This is perhaps the weirdest book I've ever read. Some parts I really loved, the ending I straight up hated, and yet I keep thinking about it. The skill required to write such a story is something I can appreciate in and of itself, and I'll check out other things by Ozick.<br/><br/>This book comes in a few almost stand alone sections and one of the middle ones has a Russian woman, Lidia, who is one of my favorite characters from any book. There is this great moment where Lidia winds up at a gathering of liberals in New York who are preaching about the glory and possibility of communism and she puts them down so hard. It was beautiful.",,,1,,,0,,,,,
30517474,The Raqqa Diaries: Escape from Islamic State,Samer,"Samer, Samer",,"=""1786330539""","=""9781786330536""",5,4.34,Hutchinson,Hardcover,108,2017,2017,2017/09/02,2017/09/18,,,read,"A short haunting read. This is a diary kept by a man living in Syria under ISIS, smuggled out to BBC reporters, and presented here as text interspersed with drawings.<br/><br/>It made me feel weird. Because I loved it, the story, the design, the paper it was printed on, but every couple pages I would remember that everything in it was real and so beyond conception it made me want to cry. What do you do when you finish a book like that?",,,1,,,0,,,,,
25526296,"Every Heart a Doorway (Wayward Children, #1)",Seanan McGuire,"McGuire, Seanan",,"=""0765385503""","=""9780765385505""",3,3.87,Tor.com,Hardcover,169,2016,2016,2017/08/18,2017/09/18,,,read,"This was a great young adult story, I'm absolutely going to check out more from this author and recommend to the young people in my life. Or to the adults who enjoy shorter, quicker reads with a touch of fantasy. I loved how diverse the cast of characters was and how the author discussed the challenges that the less conforming characters faced.",,,1,,,0,,,,,
9464733,Beauty Queens,Libba Bray,"Bray, Libba",,"=""0439895979""","=""9780439895972""",4,3.60,Scholastic Press,Hardcover,396,2011,2011,2017/09/13,2017/09/11,,,read,"This was hilarious, I actually laughed out loud. A lot. If you are a feminist, have been annoyed at society, and can enjoy poking fun at yourself and others, I can almost guarantee you'll have fun with this one.<br/><br/>The author wrote an excellent piece about the proposed Lord of the flies (but with women!) remake and that's how I learned about this book, article here -> http://ew.com/books/2017/09/01/the-diviners-author-libba-bray-has-some-thoughts-on-this-all-female-lord-of-the-flies-remake/",,,1,,,0,,,,,
647,No Logo,Naomi Klein,"Klein, Naomi",,"=""0312421435""","=""9780312421434""",4,3.86,Picador,Paperback,528,2002,1999,2017/05/13,2017/07/18,,,read,,,,1,,,0,,,,,
10356713,In Other Worlds: SF and the Human Imagination,Margaret Atwood,"Atwood, Margaret",,"=""""","=""""",3,3.73,,Kindle Edition,274,2011,2011,2017/05/26,2017/07/18,,,read,"This is a mix of short stories and essays, a few of them read by Atwood herself. <br/><br/>There were many little gems, but overall not something I'd recommend to people beyond those who are already her fans.<br/><br/>Favorite quotes:<br/>In talking about the tendency of technologists to make things worse and then propose more technical solutions: ""They are not the people that should be deciding our future. Asking these kind of scientists what should be improved upon is like asking ants what you should have in your back yard: of course they would say more ants!""<br/><br/>The whole ""Cold Blooded"" short story. I want very much to see that delivered as a monologue by theatre groups everywhere.",,,1,,,0,,,,,
23425,Status Anxiety,Alain de Botton,"Botton, Alain de",,"=""0375725350""","=""9780375725357""",0,3.90,Vintage,Paperback,306,2005,2004,,2017/07/18,skimmed,skimmed (#6),skimmed,,,,0,,,0,,,,,
9361377,How Should a Person Be?,Sheila Heti,"Heti, Sheila",,"=""0887842402""","=""9780887842405""",2,3.19,House of Anansi Press,Hardcover,306,2010,2010,2017/04/25,2017/07/18,,,read,,,,1,,,0,,,,,
21853626,Undeniable: Evolution and the Science of Creation,Bill  Nye,"Nye, Bill",,"=""1250007135""","=""9781250007131""",2,4.15,St. Martin's Press,Hardcover,309,2014,2014,2017/05/01,2017/07/18,,,read,"When I started listening to this audiobook (which he read himself) I was kind of doing it out of inertia. Out of a love for my childhood kooky hero. I'm already a scientist and not at all religious, so I wasn't surprised by anything he was presenting, and I was just about to turn it off since I wasn't really getting anything out of the book, when he dropped a real whopper of a statement: RACE ISN'T REAL.<br/><br/>Say what now? I backed up the audiobook to listen more closely. Ah, right, because this is a book that will cover only the ""facts"" he is talking about the biological trait of race. But I found it very unsettling, because race is of course very real to a great many people. And I couldn't help thinking how potentially harmful it could be for impressionable tech solutionist types to pick up this book and read the declaration ""race isn't real"" from their childhood hero.<br/><br/>It honestly makes me sad to realize that someone I very much looked up to is not a good role model. The utter lack of social understanding displayed in his books, the insistence that the scientific facts are the only facts that matter, it's unhealthy and worrying.",,,1,,,0,,,,,
15811496,Cooked: A Natural History of Transformation,Michael Pollan,"Pollan, Michael",,"=""1594204217""","=""9781594204210""",4,3.99,The Penguin Press HC,Hardcover,468,2013,2013,2017/04/21,2017/07/18,,,read,I loved the story about the cheese nun!<br/><br/>This book paired really well with https://www.goodreads.com/book/show/29771103-biting-the-hands-that-feed-us.,,,1,,,0,,,,,
20980987,"The Art of Asking; or, How I Learned to Stop Worrying and Let People Help",Amanda Palmer,"Palmer, Amanda",,"=""1455581089""","=""9781455581085""",4,3.97,Grand Central Publishing,Hardcover,339,2014,2014,2017/04/14,2017/07/18,,,read,"Highly recommend the audiobook - Amanda reads it herself! I actually haven't cared for a lot of her music, but I thought her TED talk was great and I'm a huge Neil Gaiman fan, so figured this would be good too and of course it was :)",,,1,,,0,,,,,
13839,The Botany of Desire: A Plant's-Eye View of the World,Michael Pollan,"Pollan, Michael",,"=""0375760393""","=""9780375760396""",5,4.05,Random House Trade Paperbacks,Paperback,297,2002,2001,2017/03/21,2017/07/18,,,read,,,,1,,,0,,,,,
26156469,Never Split the Difference: Negotiating As If Your Life Depended On It,Chris Voss,"Voss, Chris",Tahl Raz,"=""0062407805""","=""9780062407801""",4,4.49,HarperBusiness,Hardcover,288,2016,2016,2017/02/14,2017/07/18,,,read,"I enjoyed listening to the audiobook version, I'm writing this review many months too late, but my memory is that the narration was good. <br/><br/>The old advice that I saw for the first time while reading this book was the wisdom to ""Never be so sure of what you want that you wouldn't take something better"". I'd heard that phrased different ways but it really sunk in for the first time.<br/><br/>My other favorite quote: ""People operating with incomplete information appear crazy to those who have different information""",,,1,,,0,,,,,
30211956,Books for Living,Will Schwalbe,"Schwalbe, Will",,"=""0385353545""","=""9780385353540""",4,3.85,Knopf Publishing Group,Hardcover,288,2016,2016,2017/07/04,2017/07/18,,,read,"Reading this was like getting to have a long talk with a master book lover (also master book lover is now a thing). I wish everyone who engaged in a lifetime of reading would write a book like this, it was such a treat.",,,1,,,0,,,,,
7603,Reading Lolita in Tehran,Azar Nafisi,"Nafisi, Azar",,"=""0812971060""","=""9780812971064""",5,3.57,Random House Trade Paperbacks,Paperback,356,2003,2003,2017/08/02,2017/07/18,,,read,"I actually listened to the audiobook version and it was really well done. This book caught some criticism for not having more Persian authors, it instead centers a great many western classics (Austen, Bronte, Fitzgerald, etc).  I'm not really a fan of those classics, so I didn't expect to like this book much. What I found though was that the story of the authors life and her students, friends, and family were fascinating.<br/><br/>As for why she covers so few Persian works (and there are some) she speaks to that in the book a bit. As a professor during a time of great turmoil, and with students who were claiming the entire west was full of sick people, she felt it important to help them understand the west better.<br/><br/>There is huge insight to be gained here about revolution and radicalization, highly recommend. <br/><br/>https://www.goodreads.com/quotes/599493-it-is-also-about-loss-about-the-perishability-of-dreams",,,1,,,0,,,,,
8089415,"A Good Book, in Theory: Making Sense Through Inquiry",Alan Sears,"Sears, Alan",James Cairns,"=""1442601566""","=""9781442601567""",0,3.78,University of Toronto Press,Paperback,206,2010,2010,,2017/07/18,to-read,to-read (#78),to-read,,,,0,,,0,,,,,
464260,The Fire Next Time,James     Baldwin,"Baldwin, James",Kıvanç Güney,"=""067974472X""","=""9780679744726""",0,4.46,Vintage,Paperback,106,1992,1963,,2017/07/18,to-read,to-read (#77),to-read,,,,0,,,0,,,,,
6919721,The History of White People,Nell Irvin Painter,"Painter, Nell Irvin",,"=""0393049345""","=""9780393049343""",0,3.94,W. W. Norton & Company,Hardcover,512,2010,2010,,2017/07/18,to-read,to-read (#76),to-read,,,,0,,,0,,,,,
23468051,Culturally Responsive Teaching and the Brain: Promoting Authentic Engagement and Rigor Among Culturally and Linguistically Diverse Students,Zaretta Lynn Hammond,"Hammond, Zaretta Lynn",,"=""1483308014""","=""9781483308012""",0,4.26,Corwin Publishers,Paperback,192,2014,2014,,2017/07/18,to-read,to-read (#75),to-read,,,,0,,,0,,,,,
25152052,The Japanese Lover,Isabel Allende,"Allende, Isabel","Nick Caistor, Amanda Hopkinson","=""1501116975""","=""9781501116971""",3,3.80,Atria Books,Hardcover,322,2015,2015,2017/05/30,2017/07/17,,,read,"I admit that having read only one other book by Allende I had expected this one to be similar to her other, Island Beneath the Sea, and was a bit disappointed when it wasn't. Island Beneath the Sea was a big, sweeping, violent showcase of historical fiction. Whereas The Japanese Lover felt like... a love story, like a romance novel, like something that I would basically never decide to read. But I stuck with it and what I found was a really good story, not at all diminished by being smaller and more intimate.",,,1,,,0,,,,,
20530924,The Graveyard Book Volume 2,P. Craig Russell,"Russell, P. Craig","Neil Gaiman, David Lafuente, Scott Hampton, Kevin Nowlan, Galen Showman, Lovern Kindzierski, Rick Parker","=""0062194836""","=""9780062194831""",4,4.27,HarperCollins,Hardcover,176,2014,2014,2017/05/30,2017/07/17,,,read,"It was even more striking in the graphic novel presentation how different the two halves are. Honestly, I preferred the first half, but I hope that's something I'll grow out of. It's probably unhealthy to prefer the first half of ones life, the half that is always already done with and history, to the half that is full of uncertainty, opportunity, and the future.",,,1,,,0,,,,,
20262401,"The Graveyard Book, Volume 1",P. Craig Russell,"Russell, P. Craig","Neil Gaiman, Kevin Nowlan, Tony Harris, Scott Hampton, Galen Showman, Jill Thompson, Stephen B. Scott, Lovern Kindzierski","=""006219481X""","=""9780062194817""",4,4.29,HarperCollins,Hardcover,188,2014,2014,2017/05/29,2017/07/17,,,read,"Graphic Novel adaptation of a beloved story? Yes, please! And it does not disappoint. It's funny that one of the things I often site about preferring books to movies is that I like imaging my own faces for the characters. But one of the things I most loved about this graphic novel was seeing someone else's faces for the monsters.",,,1,,,0,,,,,
13218889,"Asia's Unknown Uprisings Volume 2: People Power in the Philippines, Burma, Tibet, China, Taiwan, Bangladesh, Nepal, Thailand and Indonesia 1947-2009",George Katsiaficas,"Katsiaficas, George",,"=""1604864885""","=""9781604864885""",0,4.08,PM Press,Paperback,520,2013,2012,,2017/07/17,currently-reading,currently-reading (#2),currently-reading,,,,1,,,0,,,,,
